{
  "schema_version": "afp/0.2",
  "report_id": "afp_test0001",
  "subject_uri": "pkg:npm/eslint@9.2.0",
  "goal": "Auto-arreglar lint antes de commitear",
  "expectation": "--fix corrige y sale con código 0",
  "observed": "Salió con código 1 sin explicar la regla no auto-fixable",
  "friction_type": "confusing_interface",
  "fault_domain": "tool",
  "severity": "degraded",
  "timestamp": "2026-05-30T18:00:00+00:00"
}
